model_family,frontier_momentum_heuristic_index,current_rank,performance_component,release_velocity_component,ecosystem_component,capability_surface_component,cost_efficiency_component,openness_component,frontier_quality_10y_probability,open_ecosystem_10y_probability,audit_note,analysis_captured_at
GPT,78.54,2,69.24870466321244,100.0,87.16569110977059,75.57969955030367,91.70461784187513,41.44153876556222,0.527,0.259,Strongest current composite and release velocity; remains top frontier-quality prior in this dataset.,2026-05-16T12:05:27+00:00
Qwen,79.16,1,74.61168294469033,87.04166666666667,80.9258860694906,59.41389762491585,94.62466043063358,97.91666666666666,0.473,0.7406666666666667,"Strong open ecosystem and good performance; credible upside, especially under open-distribution scenarios.",2026-05-16T12:05:27+00:00
Claude,55.27,4,69.98176620959673,37.04166666666667,57.78624405807851,55.604238517602994,36.120932585783535,55.0,0.0,0.0,Strong benchmark/coding signal but lower release breadth and ecosystem pull in this snapshot.,2026-05-16T12:05:27+00:00
Gemini,52.32,7,64.56022384009668,51.10416666666667,35.36137990555621,54.20337475482857,80.96757118323632,0.0,0.0,0.0,Strong benchmark breadth and ecosystem signal; weaker openness/cost signal.,2026-05-16T12:05:27+00:00
Mistral,56.7,3,45.79252584577523,37.16666666666667,70.6138038135862,34.984037973394564,100.0,95.1063829787234,0.0,0.00016666666666666666,"Strong openness/cost, but current performance and release-velocity signals are below GPT/Qwen/Claude/Gemini; should not be called raw frontier leader from this dataset.",2026-05-16T12:05:27+00:00
DeepSeek,55.01,6,33.76315256369249,34.35416666666667,78.0039808219095,52.68078238606863,85.89234842315102,92.27043673012318,0.0,0.0,Interpret with caution; public signals are incomplete and component-dependent.,2026-05-16T12:05:27+00:00
Llama,55.09,5,36.74695603556637,4.645833333333334,81.34385788352981,63.50715056736364,100.0,91.60702772404899,0.0,0.00016666666666666666,Interpret with caution; public signals are incomplete and component-dependent.,2026-05-16T12:05:27+00:00
Grok,28.67,10,37.58927195032708,25.1875,27.388980215879798,48.1583000374535,0.0,1.8421052631578947,0.0,0.0,Interpret with caution; public signals are incomplete and component-dependent.,2026-05-16T12:05:27+00:00
